"author","comment","commentsCount","pageUrl","replyCount","title","type","videoID","voteCount"
"@xhunteronename4656","Bg @Bennix Klw  nilai nya sekalian berubah misalnya 1 rupiah setara dengan 1 dollar apa2 yg perlu dilakukan","6358","https://youtu.be/GRA-0D9PojY?si=RNrPNibbLbVH9BRT","0","REDENOMINASI PURBAYA! Uang Rp1000 Jadi Rp1, Ribuan Triliun Akan Kembali ke Negara!","comment",,"0"
"@firepumpspp","semoga segera terlaksana","6358","https://youtu.be/GRA-0D9PojY?si=RNrPNibbLbVH9BRT","0","REDENOMINASI PURBAYA! Uang Rp1000 Jadi Rp1, Ribuan Triliun Akan Kembali ke Negara!","comment",,"0"
"@ellyya09","Setuju banget dengan cara rene dominasi ini biar keluar semua bandit2 dan koruptor saya dukung 100% bpk Purbaya💪💪👍🏻👍🏻👍🏻","6358","https://youtu.be/GRA-0D9PojY?si=RNrPNibbLbVH9BRT","0","REDENOMINASI PURBAYA! Uang Rp1000 Jadi Rp1, Ribuan Triliun Akan Kembali ke Negara!","comment",,"0"
"@SahrulGunawan-x6e","untung aku gak punya uang","6358","https://youtu.be/GRA-0D9PojY?si=RNrPNibbLbVH9BRT","0","REDENOMINASI PURBAYA! Uang Rp1000 Jadi Rp1, Ribuan Triliun Akan Kembali ke Negara!","comment",,"0"
"@jarotization","Gw sebenarnya bosen pake banget, wacana redenominasi sudah basi banget dari anak gw SD sampai sekarang sudah kerja, dari gw masih kerja sampai pensiun belum terlaksana juga. Tapi kalo terlaksana bagus juga ane sangat mendukung pak Purbaya, minusnya kita harus terbiasa hitung pakai sen.","6358","https://youtu.be/GRA-0D9PojY?si=RNrPNibbLbVH9BRT","0","REDENOMINASI PURBAYA! Uang Rp1000 Jadi Rp1, Ribuan Triliun Akan Kembali ke Negara!","comment",,"0"
"@AyaSunda","Owhhh gitu ya","6358","https://youtu.be/GRA-0D9PojY?si=RNrPNibbLbVH9BRT","0","REDENOMINASI PURBAYA! Uang Rp1000 Jadi Rp1, Ribuan Triliun Akan Kembali ke Negara!","comment",,"0"
"@emirincian9742","Mantap pak purbaya. Terima kasih bang bennix, mudah mudahan negara ini melesat JD ekonomi terbaik","6358","https://youtu.be/GRA-0D9PojY?si=RNrPNibbLbVH9BRT","0","REDENOMINASI PURBAYA! Uang Rp1000 Jadi Rp1, Ribuan Triliun Akan Kembali ke Negara!","comment",,"0"
"@mustikapurnamacendanajuwit1363","Kayaknya lebih bahaya elo ketimbang anjing itu Ben. Hati hati ya, jaga dirimu","6358","https://youtu.be/GRA-0D9PojY?si=RNrPNibbLbVH9BRT","0","REDENOMINASI PURBAYA! Uang Rp1000 Jadi Rp1, Ribuan Triliun Akan Kembali ke Negara!","comment",,"0"
"@nabilasiska308","rumah cuma 166.000, tapi nyari nya tetap ngoyo. kalau gaji umr 3.500 wkwkwk","6358","https://youtu.be/GRA-0D9PojY?si=RNrPNibbLbVH9BRT","0","REDENOMINASI PURBAYA! Uang Rp1000 Jadi Rp1, Ribuan Triliun Akan Kembali ke Negara!","comment",,"0"
"@alifudinwahyu581","Ayo, Buktikan","6358","https://youtu.be/GRA-0D9PojY?si=RNrPNibbLbVH9BRT","0","REDENOMINASI PURBAYA! Uang Rp1000 Jadi Rp1, Ribuan Triliun Akan Kembali ke Negara!","comment",,"0"
"@MartinSukoyo-yj1sb","Setuju redominasi","6358","https://youtu.be/GRA-0D9PojY?si=RNrPNibbLbVH9BRT","0","REDENOMINASI PURBAYA! Uang Rp1000 Jadi Rp1, Ribuan Triliun Akan Kembali ke Negara!","comment",,"0"
"@siherb","ayo dong para koruptor, sini gw bantu, 1 T seharga 10 M, bukain gw usaha jadi seakan itu uang usaha gw, deal2 an aja ayo sini saling bantu Pak ❤","6358","https://youtu.be/GRA-0D9PojY?si=RNrPNibbLbVH9BRT","1","REDENOMINASI PURBAYA! Uang Rp1000 Jadi Rp1, Ribuan Triliun Akan Kembali ke Negara!","comment",,"0"
"@krisnhaone2922","Saya percaya hambatan percepatan perekonomian Indonesia salah satunya adalah orang²yang ga mau Indonesia maju,, ga mau rakyat Indonesia mandiri secara ekonomi makanya segala cara usaha redenominasi di bikin terlihat buruk
Mari kita bikin rupiah lebih berwibawa dengan redenominasi","6358","https://youtu.be/GRA-0D9PojY?si=RNrPNibbLbVH9BRT","0","REDENOMINASI PURBAYA! Uang Rp1000 Jadi Rp1, Ribuan Triliun Akan Kembali ke Negara!","comment",,"1"
"@anybody-o3k","Tapi Vietnam ekonominya maju kan?","6358","https://youtu.be/GRA-0D9PojY?si=RNrPNibbLbVH9BRT","0","REDENOMINASI PURBAYA! Uang Rp1000 Jadi Rp1, Ribuan Triliun Akan Kembali ke Negara!","comment",,"0"
"@andemoiselle","Sumpah ya di X itu massive banget 😂😂😂😂","6358","https://youtu.be/GRA-0D9PojY?si=RNrPNibbLbVH9BRT","0","REDENOMINASI PURBAYA! Uang Rp1000 Jadi Rp1, Ribuan Triliun Akan Kembali ke Negara!","comment",,"0"
"@sumiatisumiati9189","Alhamndulilah achirnya rakyat yg jujur berjodoh dengan pemimpin jg jujur pula MENKEU Purbaya  yudi sadewo  cocok sdh.  Kapok Kau koroptor bawa itu uangmu hasil koropsi  untuk menimbun  badanmu klo mati. Cepat dilaksanakan pk Pur REDENOMINASI nya.","6358","https://youtu.be/GRA-0D9PojY?si=RNrPNibbLbVH9BRT","0","REDENOMINASI PURBAYA! Uang Rp1000 Jadi Rp1, Ribuan Triliun Akan Kembali ke Negara!","comment",,"2"
"@jimot_lucky_tampan","Harus Redenominasi Rupiah ‼️‼️ mata uang kita udah terlalu di lecehkan sm negara lain.","6358","https://youtu.be/GRA-0D9PojY?si=RNrPNibbLbVH9BRT","0","REDENOMINASI PURBAYA! Uang Rp1000 Jadi Rp1, Ribuan Triliun Akan Kembali ke Negara!","comment",,"0"
"@fofoyfound9484","Gw bangga jadi orang miskin yg selalu memutar perekonomian tanpa  mendelep uang yang itu tidak ada faedahnya untuk perputaran ekonomi nasional 🔥","6358","https://youtu.be/GRA-0D9PojY?si=RNrPNibbLbVH9BRT","0","REDENOMINASI PURBAYA! Uang Rp1000 Jadi Rp1, Ribuan Triliun Akan Kembali ke Negara!","comment",,"0"
"@akbarhpc3576","4 menit di awal gw langsung paham maksudnya bang","6358","https://youtu.be/GRA-0D9PojY?si=RNrPNibbLbVH9BRT","0","REDENOMINASI PURBAYA! Uang Rp1000 Jadi Rp1, Ribuan Triliun Akan Kembali ke Negara!","comment",,"0"
"@jkarif0488","setuju banget redenominasi","6358","https://youtu.be/GRA-0D9PojY?si=RNrPNibbLbVH9BRT","0","REDENOMINASI PURBAYA! Uang Rp1000 Jadi Rp1, Ribuan Triliun Akan Kembali ke Negara!","comment",,"0"
"@JuliaJahim-x7m","Tapi nnti setelah redenemorasi telah jalan, trus para koruptor anjing menyimpan duit lagi gimana bang?","6358","https://youtu.be/GRA-0D9PojY?si=RNrPNibbLbVH9BRT","0","REDENOMINASI PURBAYA! Uang Rp1000 Jadi Rp1, Ribuan Triliun Akan Kembali ke Negara!","comment",,"0"
"@ferdiyansyah6252","yang ketiban apes cuma software engineer bang @Bennix, data yg udah terlanjur di input ke system harus di update atau cuma diubah secara tampilan wkwkwkkw","6358","https://youtu.be/GRA-0D9PojY?si=RNrPNibbLbVH9BRT","0","REDENOMINASI PURBAYA! Uang Rp1000 Jadi Rp1, Ribuan Triliun Akan Kembali ke Negara!","comment",,"0"
"@ModalMimpi","Gass","6358","https://youtu.be/GRA-0D9PojY?si=RNrPNibbLbVH9BRT","0","REDENOMINASI PURBAYA! Uang Rp1000 Jadi Rp1, Ribuan Triliun Akan Kembali ke Negara!","comment",,"0"
"@siherb","bagi yang 10 M, saya bisa bantu juga tapi pricenya 100 juta, kalau punya 1 M, Yah kasihan lah itu habisin sendiri aja pak, atau ttp minta bantu tak bantuin juga yah 1 M seharga 10 jt.","6358","https://youtu.be/GRA-0D9PojY?si=RNrPNibbLbVH9BRT","0","REDENOMINASI PURBAYA! Uang Rp1000 Jadi Rp1, Ribuan Triliun Akan Kembali ke Negara!","reply",,"0"
"@Jonggun01","Mulai dah simpen duit lu yang banyak 0 nya 😂😂

Biar anak cucu lu tau elu pernah mengang uang dengan 0 yang banyak 😂😂","6358","https://youtu.be/GRA-0D9PojY?si=RNrPNibbLbVH9BRT","0","REDENOMINASI PURBAYA! Uang Rp1000 Jadi Rp1, Ribuan Triliun Akan Kembali ke Negara!","comment",,"0"
"@BapakTubeng","SAYA SEBAGAI RAKYAT INDONESIA SANGAT SETUJU KALAU NOMINAL RUPIAH, DAR 1000 RUPIAH, JADI 1 RUPIAH","6358","https://youtu.be/GRA-0D9PojY?si=RNrPNibbLbVH9BRT","0","REDENOMINASI PURBAYA! Uang Rp1000 Jadi Rp1, Ribuan Triliun Akan Kembali ke Negara!","comment",,"0"
"@msani4118","Om gw di tanjung priok udah ga aneh sama redenominasi..kita2 kalo beli barang contoh HP bekas.bro brp nih HP dia bilang seribu lima ratus..kta tawar seribu ya..tambahin bos seribu empat ratus lah..kita paham itu satu juta empat ratus..jadi buat yg banyak omong katanya orang pinter tp takut sama redenominasi..maen situ kurang kedalem bos..nih anak periuk yg katanya begajulan udah pake tuh yg sama om Purbaya mau di sahin..terimakasih om video nya semoga mencerahkan pikiran si oon2 itu","6358","https://youtu.be/GRA-0D9PojY?si=RNrPNibbLbVH9BRT","0","REDENOMINASI PURBAYA! Uang Rp1000 Jadi Rp1, Ribuan Triliun Akan Kembali ke Negara!","comment",,"0"
"@hasbihaliksy8231","Rakyat sangat setuju harus redenominasi","6358","https://youtu.be/GRA-0D9PojY?si=RNrPNibbLbVH9BRT","0","REDENOMINASI PURBAYA! Uang Rp1000 Jadi Rp1, Ribuan Triliun Akan Kembali ke Negara!","comment",,"5"
"@almuakıdyahduth","Bagus nih redenominasi, harus ini bang","6358","https://youtu.be/GRA-0D9PojY?si=RNrPNibbLbVH9BRT","0","REDENOMINASI PURBAYA! Uang Rp1000 Jadi Rp1, Ribuan Triliun Akan Kembali ke Negara!","comment",,"0"
"@fuyuneko3","Pak pur lewat anaknya nolak, katanya bikin psikologis kita selalu ingin membeli, membuat harga gampang naik dan bisa hyper inflasi","6358","https://youtu.be/GRA-0D9PojY?si=RNrPNibbLbVH9BRT","0","REDENOMINASI PURBAYA! Uang Rp1000 Jadi Rp1, Ribuan Triliun Akan Kembali ke Negara!","comment",,"0"
"@AriaHalim-g1f5d","Gmn dengan korea selatan om ben?","6358","https://youtu.be/GRA-0D9PojY?si=RNrPNibbLbVH9BRT","0","REDENOMINASI PURBAYA! Uang Rp1000 Jadi Rp1, Ribuan Triliun Akan Kembali ke Negara!","comment",,"0"
"@budiwibowo8350","Ya dukung pak purbaya","6358","https://youtu.be/GRA-0D9PojY?si=RNrPNibbLbVH9BRT","0","REDENOMINASI PURBAYA! Uang Rp1000 Jadi Rp1, Ribuan Triliun Akan Kembali ke Negara!","comment",,"0"
"@Rcxrymox","Positifnya lagi Uang receh pecahan 100,200 rupiah yang beredar dimasyarakat kecil juga bakalan terus berputar mau di warung/kelontong, daripada dianggap udah gak laku dan cuman dikumpul buat dituker ke minimarket.","6358","https://youtu.be/GRA-0D9PojY?si=RNrPNibbLbVH9BRT","0","REDENOMINASI PURBAYA! Uang Rp1000 Jadi Rp1, Ribuan Triliun Akan Kembali ke Negara!","comment",,"0"
"@antonton-b4g","kruptor itu lebih pintar, duit yg asil krup itu bisa di simpen di bank asing dan di jdikan mata uang asing,bagi kruptor itu ga ngaruh, yg ngaruh itu masyrakat, ya itu yg 1000 rupiah jdi1 rupiah yg harganya barang harga awal 1500rupiah otomatis di jual jdi 2 rupiah dong berati naik 500rupiah dong","6358","https://youtu.be/GRA-0D9PojY?si=RNrPNibbLbVH9BRT","0","REDENOMINASI PURBAYA! Uang Rp1000 Jadi Rp1, Ribuan Triliun Akan Kembali ke Negara!","comment",,"0"
"@Kucing_OYEN-j6r","Gak usah jauh di Amerika di Inggris.... Di negara tetangga aja seperti Malaysia duit kita dipandang sebelah mata.. 
Kata orang malayasia: INI JUTA RINGGIT LAH.. BUKAN JUTA INDONESIA..","6358","https://youtu.be/GRA-0D9PojY?si=RNrPNibbLbVH9BRT","0","REDENOMINASI PURBAYA! Uang Rp1000 Jadi Rp1, Ribuan Triliun Akan Kembali ke Negara!","comment",,"0"
"@Nelis-d9i","Gmna ekonomi mau tumbuh KLO koruptor dan para bandit sembunyiin duitnya, tpi klo redenominasi berhasil di lakukan maka uang2 itu akan keluar ke pasaran sehingga ekonomi akan tumbuh dngn cepat,","6358","https://youtu.be/GRA-0D9PojY?si=RNrPNibbLbVH9BRT","0","REDENOMINASI PURBAYA! Uang Rp1000 Jadi Rp1, Ribuan Triliun Akan Kembali ke Negara!","comment",,"0"
"@SamSung-pm3tn","Itu namanya ngecheat..rupiah jatuh alasan redoniminasi😂😂","6358","https://youtu.be/GRA-0D9PojY?si=RNrPNibbLbVH9BRT","0","REDENOMINASI PURBAYA! Uang Rp1000 Jadi Rp1, Ribuan Triliun Akan Kembali ke Negara!","comment",,"0"
"@Kucing_OYEN-j6r","Ayo bang... Teruskan perjuanganmu... 🔥","6358","https://youtu.be/GRA-0D9PojY?si=RNrPNibbLbVH9BRT","0","REDENOMINASI PURBAYA! Uang Rp1000 Jadi Rp1, Ribuan Triliun Akan Kembali ke Negara!","comment",,"0"
"@jie99900","Perdayanomic😂😂","6358","https://youtu.be/GRA-0D9PojY?si=RNrPNibbLbVH9BRT","0","REDENOMINASI PURBAYA! Uang Rp1000 Jadi Rp1, Ribuan Triliun Akan Kembali ke Negara!","comment",,"0"
"@ebensinaga8633","Dari dulu saya nunggu redenominasi, mudah2an dieksekusi","6358","https://youtu.be/GRA-0D9PojY?si=RNrPNibbLbVH9BRT","0","REDENOMINASI PURBAYA! Uang Rp1000 Jadi Rp1, Ribuan Triliun Akan Kembali ke Negara!","comment",,"0"
"@Kucing_OYEN-j6r","Aku seneng banget gaya cara bicara bang ben..... Pedes pedes manis... 😁","6358","https://youtu.be/GRA-0D9PojY?si=RNrPNibbLbVH9BRT","0","REDENOMINASI PURBAYA! Uang Rp1000 Jadi Rp1, Ribuan Triliun Akan Kembali ke Negara!","comment",,"0"
"@danangdrewofficial2058","Itu baik. Abis koruptor belanja karna pengurangan 0 kalo mentalnya nimbun ya nimbun lagi","6358","https://youtu.be/GRA-0D9PojY?si=RNrPNibbLbVH9BRT","0","REDENOMINASI PURBAYA! Uang Rp1000 Jadi Rp1, Ribuan Triliun Akan Kembali ke Negara!","comment",,"0"
"@kentkent2111","Setujuu bang...Tuhan lindungi Pak Purbaya Dan kita semua... Amiiinn","6358","https://youtu.be/GRA-0D9PojY?si=RNrPNibbLbVH9BRT","0","REDENOMINASI PURBAYA! Uang Rp1000 Jadi Rp1, Ribuan Triliun Akan Kembali ke Negara!","comment",,"0"
"@HutasoitHutasoit123-o4s","Kalau harga barang bisa di kontrol contohnya yg sebelum nya harga Rp.1.000,_ menjadi Rp.1,_ tapi factanya didalam negeri saja tidak bisa apalagi di Dunia Internasional.","6358","https://youtu.be/GRA-0D9PojY?si=RNrPNibbLbVH9BRT","0","REDENOMINASI PURBAYA! Uang Rp1000 Jadi Rp1, Ribuan Triliun Akan Kembali ke Negara!","comment",,"0"
"@emzonjhonardi4904","Sangat setuju bang..biar uang kuropsi itu muncul ke permukaan..lanjutkan pak purbaya","6358","https://youtu.be/GRA-0D9PojY?si=RNrPNibbLbVH9BRT","0","REDENOMINASI PURBAYA! Uang Rp1000 Jadi Rp1, Ribuan Triliun Akan Kembali ke Negara!","comment",,"0"
"@FahmiAtikah","Bagi saya setuju","6358","https://youtu.be/GRA-0D9PojY?si=RNrPNibbLbVH9BRT","0","REDENOMINASI PURBAYA! Uang Rp1000 Jadi Rp1, Ribuan Triliun Akan Kembali ke Negara!","comment",,"0"
"@chandragultom7887","Alasan setuju.. peredaran uang palsu berkurang.. masyarakat jadi tenang..dampak positif..","6358","https://youtu.be/GRA-0D9PojY?si=RNrPNibbLbVH9BRT","0","REDENOMINASI PURBAYA! Uang Rp1000 Jadi Rp1, Ribuan Triliun Akan Kembali ke Negara!","comment",,"0"
"@widododonoredjo6818","Mantap👍... Maju terus bang bennix... Gaskeun pak Pur...","6358","https://youtu.be/GRA-0D9PojY?si=RNrPNibbLbVH9BRT","0","REDENOMINASI PURBAYA! Uang Rp1000 Jadi Rp1, Ribuan Triliun Akan Kembali ke Negara!","comment",,"0"
"@HutasoitHutasoit123-o4s","Apa udah dipikir Rupiah akan lari ke Dollar rupiah akan makin ancur.","6358","https://youtu.be/GRA-0D9PojY?si=RNrPNibbLbVH9BRT","0","REDENOMINASI PURBAYA! Uang Rp1000 Jadi Rp1, Ribuan Triliun Akan Kembali ke Negara!","comment",,"0"
"@fardiz4894","Lanjutkan pak Purbaya udah mantap ide bapak","6358","https://youtu.be/GRA-0D9PojY?si=RNrPNibbLbVH9BRT","0","REDENOMINASI PURBAYA! Uang Rp1000 Jadi Rp1, Ribuan Triliun Akan Kembali ke Negara!","comment",,"0"
"@Hery195","Mantap.. Purbaya sebagai mekanik.. Prabowo sebagai bos bengkel..🇮🇩🇮🇩🇮🇩","6358","https://youtu.be/GRA-0D9PojY?si=RNrPNibbLbVH9BRT","0","REDENOMINASI PURBAYA! Uang Rp1000 Jadi Rp1, Ribuan Triliun Akan Kembali ke Negara!","comment",,"0"
"@Gbgn03","Ya, tapi ente ga selalu benar, 
Money illusion? Nga, rumah akan tetap mahal karena pemainnya itu itu aja, yak orang2 kapitalis kek elu yg seenaknya naikin harga property ga ngotak.
Problemnya utamanya di kesenjangan ekonomi,
""tapi mas, lu kurang kerja keras makanya lu ga bisa beli rumah?"", matamu","6358","https://youtu.be/GRA-0D9PojY?si=RNrPNibbLbVH9BRT","0","REDENOMINASI PURBAYA! Uang Rp1000 Jadi Rp1, Ribuan Triliun Akan Kembali ke Negara!","comment",,"1"
"@HutasoitHutasoit123-o4s","Siape sih ini yg membodoh bodohkan orang tapi dia sendiri tidak bisa menunjukkan kepintarannya ditengah masyarakat luas malah menunjukkan ketidak smartnya padahal ini sangat sederhana contohnya jika mata uang satu negara kuat berarti nilainya tinggi artinya uangnya dibutuhkan dunia tapi ketika daya saing uang satu negara tidak ada daya saing di Dunia Internasional maka uang itu akan turun nilainya atau pamornya jadi sebetulnya hanya meningkatkan daya saing disegala bidang tidak perlu hiruk pikuk jadi kalau siapapun merasa pintar tunjukkan lah jadi berkat ditengah masyarakat luas gitu aja kok repot.","6358","https://youtu.be/GRA-0D9PojY?si=RNrPNibbLbVH9BRT","0","REDENOMINASI PURBAYA! Uang Rp1000 Jadi Rp1, Ribuan Triliun Akan Kembali ke Negara!","comment",,"0"
"@gudangkardusromly","BETUL ini terobosannya","6358","https://youtu.be/GRA-0D9PojY?si=RNrPNibbLbVH9BRT","0","REDENOMINASI PURBAYA! Uang Rp1000 Jadi Rp1, Ribuan Triliun Akan Kembali ke Negara!","comment",,"0"
"@blacklist6606","Si kontol sok tahu bangsattt","6358","https://youtu.be/GRA-0D9PojY?si=RNrPNibbLbVH9BRT","0","REDENOMINASI PURBAYA! Uang Rp1000 Jadi Rp1, Ribuan Triliun Akan Kembali ke Negara!","comment",,"0"
"@rudiansahnurjaman8329","SAYA MENDUKUNG REDENOMINASI","6358","https://youtu.be/GRA-0D9PojY?si=RNrPNibbLbVH9BRT","0","REDENOMINASI PURBAYA! Uang Rp1000 Jadi Rp1, Ribuan Triliun Akan Kembali ke Negara!","comment",,"0"
"@JoXeRTV","GW SETUJU BGT REDENOMINASI","6358","https://youtu.be/GRA-0D9PojY?si=RNrPNibbLbVH9BRT","0","REDENOMINASI PURBAYA! Uang Rp1000 Jadi Rp1, Ribuan Triliun Akan Kembali ke Negara!","comment",,"0"
"@fahribarry10","kapan ya di terlaksana nya ya lama bangat","6358","https://youtu.be/GRA-0D9PojY?si=RNrPNibbLbVH9BRT","0","REDENOMINASI PURBAYA! Uang Rp1000 Jadi Rp1, Ribuan Triliun Akan Kembali ke Negara!","comment",,"0"
"@Hamidah-wt3hf","Dahulu kata ibu saya juga pernah terjadi Redenominasi di Indonesia 🙏","6358","https://youtu.be/GRA-0D9PojY?si=RNrPNibbLbVH9BRT","0","REDENOMINASI PURBAYA! Uang Rp1000 Jadi Rp1, Ribuan Triliun Akan Kembali ke Negara!","comment",,"0"
"@JOkOdOK-F4ked_Fu2Fa2-PLOngo2","si-WOWO Presiden OMON2.rezim si-WOWO hanya untuk mencuci kotoran nya si-WIWI dan para TERMUL nya. kasus WHOOSH dan ijazah PALSU, sENGJA di Lindungi si WOWO, Ternyata si-WOWO dan SEMUA KEPARAT HUKUM jg bagian dari TERMUL dan ceboker nya si-WIWI dan FU2FA2 si-ANAK HARAM KONSTITUSI.,si JENDRAL yg dulu MACAN ASIA skrng sdh berubah jd KUCING OMPONG krn Realita si-WOWO TUNDUK, TERSANDRA dan TAKUT kpd ODGJ (Otak Dungu Gibr Jkw). kartu trub nya si-WOWO di pegang si-WIWI.","6358","https://youtu.be/GRA-0D9PojY?si=RNrPNibbLbVH9BRT","0","REDENOMINASI PURBAYA! Uang Rp1000 Jadi Rp1, Ribuan Triliun Akan Kembali ke Negara!","comment",,"0"
"@jefrygustiariansyah6841","Betul itu...kalau di batas... Emang ...uang mata ri...ngak ada harganya ... Betul itu.... Betul itu... Di batas tempat saya kbanyakan ...mngunakan uang ading yaitu Malay... JD uang mata ri tu ngak ada harganya.m..","6358","https://youtu.be/GRA-0D9PojY?si=RNrPNibbLbVH9BRT","0","REDENOMINASI PURBAYA! Uang Rp1000 Jadi Rp1, Ribuan Triliun Akan Kembali ke Negara!","comment",,"0"
"@lisrijkschroeff8675","Tidak ada urgencynya sama sekali","6358","https://youtu.be/GRA-0D9PojY?si=RNrPNibbLbVH9BRT","0","REDENOMINASI PURBAYA! Uang Rp1000 Jadi Rp1, Ribuan Triliun Akan Kembali ke Negara!","comment",,"0"
"@zholkhornainjaafar1966","Indonesia buat apa pun tidak berjaya 🤭 kita tungu Dan lihat.","6358","https://youtu.be/GRA-0D9PojY?si=RNrPNibbLbVH9BRT","0","REDENOMINASI PURBAYA! Uang Rp1000 Jadi Rp1, Ribuan Triliun Akan Kembali ke Negara!","comment",,"0"
"@khsukmachannel190","Mestinya semua pihak dukung kemenkeu bukan malah gembosi dan mau gagalkan.","6358","https://youtu.be/GRA-0D9PojY?si=RNrPNibbLbVH9BRT","0","REDENOMINASI PURBAYA! Uang Rp1000 Jadi Rp1, Ribuan Triliun Akan Kembali ke Negara!","comment",,"0"
"@jefrygustiariansyah6841","Seharus nya seperti itu ..","6358","https://youtu.be/GRA-0D9PojY?si=RNrPNibbLbVH9BRT","0","REDENOMINASI PURBAYA! Uang Rp1000 Jadi Rp1, Ribuan Triliun Akan Kembali ke Negara!","comment",,"0"
"@ashuraplf6677","Terus berjuang bg ,yg benar,harus benar 🙏","6358","https://youtu.be/GRA-0D9PojY?si=RNrPNibbLbVH9BRT","0","REDENOMINASI PURBAYA! Uang Rp1000 Jadi Rp1, Ribuan Triliun Akan Kembali ke Negara!","comment",,"0"
"@cepeful9999","Ayo kita dukung redenominasi rupiah","6358","https://youtu.be/GRA-0D9PojY?si=RNrPNibbLbVH9BRT","0","REDENOMINASI PURBAYA! Uang Rp1000 Jadi Rp1, Ribuan Triliun Akan Kembali ke Negara!","comment",,"1"
"@umpubuyutkuning5877","Setuju redenominasi adar duit siluman nampak dan beredar...","6358","https://youtu.be/GRA-0D9PojY?si=RNrPNibbLbVH9BRT","0","REDENOMINASI PURBAYA! Uang Rp1000 Jadi Rp1, Ribuan Triliun Akan Kembali ke Negara!","comment",,"0"
"@AnesaAll","Jadiseperti.oman.matauang.nya.25.bs50bs10bs20bs.paling.gede50real.wawlohu.alam","6358","https://youtu.be/GRA-0D9PojY?si=RNrPNibbLbVH9BRT","0","REDENOMINASI PURBAYA! Uang Rp1000 Jadi Rp1, Ribuan Triliun Akan Kembali ke Negara!","comment",,"0"
"@hendrikpadang4510","Maaf pertanyaan Mr. Bennix, apakah dengan mengurangi digit ada kemungkinan  mempengaruhi penguatan nilai mata uang kita ya?","6358","https://youtu.be/GRA-0D9PojY?si=RNrPNibbLbVH9BRT","2","REDENOMINASI PURBAYA! Uang Rp1000 Jadi Rp1, Ribuan Triliun Akan Kembali ke Negara!","comment",,"0"
"@sulthanuladlidaroini","❤Re Denominasi lanjut","6358","https://youtu.be/GRA-0D9PojY?si=RNrPNibbLbVH9BRT","0","REDENOMINASI PURBAYA! Uang Rp1000 Jadi Rp1, Ribuan Triliun Akan Kembali ke Negara!","comment",,"0"
"@irfanharianto2256","Kazakstan apa indostan?🤣🤣🤣","6358","https://youtu.be/GRA-0D9PojY?si=RNrPNibbLbVH9BRT","0","REDENOMINASI PURBAYA! Uang Rp1000 Jadi Rp1, Ribuan Triliun Akan Kembali ke Negara!","comment",,"0"
"@leeinsthingyating9279","kelimpungan para korup 😂😂😂😂😂😂😂","6358","https://youtu.be/GRA-0D9PojY?si=RNrPNibbLbVH9BRT","0","REDENOMINASI PURBAYA! Uang Rp1000 Jadi Rp1, Ribuan Triliun Akan Kembali ke Negara!","comment",,"0"
"@oceansky8564","kali ini saya kurang setuju soal redenominasi pak purbaya, khawatir dengan sanering tahun 1950-1960 banyak orang jadi miskin mendadak!. walau negara akan menjamin karena berbeda antara redenominasi dengan Sanering, namun siapa yang yakin dengan negara saat ini?,,, saya Meragukan ini, saya tak mengajak teman sebangsa ikut saya, saya hanya mengaja coba merenungkan saja, keputusan adalah masing masing","6358","https://youtu.be/GRA-0D9PojY?si=RNrPNibbLbVH9BRT","2","REDENOMINASI PURBAYA! Uang Rp1000 Jadi Rp1, Ribuan Triliun Akan Kembali ke Negara!","comment",,"0"
"@Sugih-x1k","Redenominasi telah di gaungkan org jawa dr dulu, contoh sejuta, org bilang klau transaksi sewu,","6358","https://youtu.be/GRA-0D9PojY?si=RNrPNibbLbVH9BRT","0","REDENOMINASI PURBAYA! Uang Rp1000 Jadi Rp1, Ribuan Triliun Akan Kembali ke Negara!","comment",,"0"
"@upinztube","Entahlah, gw sih ga setuju, ga percaya redenominasi bisa dorong ekonomi, how ?! Inflasi sih iya, bayangkan pembulatan harga, misal harga asalnya 7350, bayangin kalo redenominasi, 7.35 apa mungkin ? Pastinya akan d bulatkan jadi 7.5, nah jadi lebih mahal kan ?
Efek redenominasi bikin mata uang kita nampak ""lebih bernilai"" d banding mata uang asing, misal 1 usd = 17000, ok, kalo redenominasi jadi 1 usd = 17 rupiah, seakan akan rupiah kita murah, tapi KOPONG pondasi kita, mau bikin mata uang kita bernilai, ya ga gitu caranya, yang bener tuh turunin inflasi, perbanyak expor, tekan impor, kebijakan fiskal yang bikin mata uang kita sexy di hadapan investor asing, stabilitas politik d benerin, cadangan devisa diperbanyak, itu yang bener, Pondasi kita harus kuat, kalo cuma redenominasi itu hanya ""tampilan luar"" ibarat cewe cantik, eh cantiknya dari filter hape, instan iya, tapi aslinya jelek !
Redenominasi memberantas korupsi, satu sisi emang bingung tukar uangnya, tapi katanya kan ada waktu 10 tahun buat tuker uang, masi panjanh waktunya, aman !!! Sekarang banyangin akibat redenominasi, dikeluarin pecahan baru 1000, anjir selembar satu juta, keluar lagi pecahan baru 10000, bused duit 10juta cuma selembar.... Makin seneng lah koruptor 😂😂","6358","https://youtu.be/GRA-0D9PojY?si=RNrPNibbLbVH9BRT","0","REDENOMINASI PURBAYA! Uang Rp1000 Jadi Rp1, Ribuan Triliun Akan Kembali ke Negara!","comment",,"0"
"@ainulyakin7027","Baru kemarin ketemu pak purbaya ketemu di jw Marriott Surabaya","6358","https://youtu.be/GRA-0D9PojY?si=RNrPNibbLbVH9BRT","0","REDENOMINASI PURBAYA! Uang Rp1000 Jadi Rp1, Ribuan Triliun Akan Kembali ke Negara!","comment",,"0"
"@Kris-ican","demi perubaha indonesia, aku setuju, bosan lihat indonesia gini gini aja, malah tambah parah","6358","https://youtu.be/GRA-0D9PojY?si=RNrPNibbLbVH9BRT","0","REDENOMINASI PURBAYA! Uang Rp1000 Jadi Rp1, Ribuan Triliun Akan Kembali ke Negara!","comment",,"0"
"@BeliauiniRheanelle","Bayangin aja pas berlaku , koruptor pasti bingung 😂
Mau di tuker , ntr ketahuan kekayaan goip dia","6358","https://youtu.be/GRA-0D9PojY?si=RNrPNibbLbVH9BRT","0","REDENOMINASI PURBAYA! Uang Rp1000 Jadi Rp1, Ribuan Triliun Akan Kembali ke Negara!","comment",,"1"
"@dhiebabyor","Udah wacana dr 2009","6358","https://youtu.be/GRA-0D9PojY?si=RNrPNibbLbVH9BRT","0","REDENOMINASI PURBAYA! Uang Rp1000 Jadi Rp1, Ribuan Triliun Akan Kembali ke Negara!","comment",,"0"
"@agusprihmanuto3492","Gas p Mentri setuju","6358","https://youtu.be/GRA-0D9PojY?si=RNrPNibbLbVH9BRT","0","REDENOMINASI PURBAYA! Uang Rp1000 Jadi Rp1, Ribuan Triliun Akan Kembali ke Negara!","comment",,"0"
"@anakarwah1425","#KitaSetujuRedenominasi","6358","https://youtu.be/GRA-0D9PojY?si=RNrPNibbLbVH9BRT","0","REDENOMINASI PURBAYA! Uang Rp1000 Jadi Rp1, Ribuan Triliun Akan Kembali ke Negara!","comment",,"0"
"@ahmadfulful8943","Saya setuju Redenominasi dan mendukung kebijakan pak Purbaya ..","6358","https://youtu.be/GRA-0D9PojY?si=RNrPNibbLbVH9BRT","0","REDENOMINASI PURBAYA! Uang Rp1000 Jadi Rp1, Ribuan Triliun Akan Kembali ke Negara!","comment",,"0"
"@HpInfinix-u3g","Bennix lebih cerdas dari para ekonom yg berkata redominasi TDK ada pengaruhnya bagi perkem bangan ekonomi Indonesia.
Pendapat awwam saya kalau memang redominasi itu TDK ada manfaatnya..lalu pertanyaannya..
Kenapa harus dibuat peraturan adanya redominasi ?
Padahal sebetulnya redominasi itu akan sangat bermanfaat bagi rakyat, ekonomi nasional dan seluruh kehidupan bangsa ini.
Seluruh bangsa ..mari kita dukung rencana acara redominasi agar segera terlaksana.","6358","https://youtu.be/GRA-0D9PojY?si=RNrPNibbLbVH9BRT","0","REDENOMINASI PURBAYA! Uang Rp1000 Jadi Rp1, Ribuan Triliun Akan Kembali ke Negara!","comment",,"0"
