"author","comment","commentsCount","pageUrl","replyCount","title","type","videoID","voteCount"
"@romisulaeman282","Setuju

Biar uang yang dirampok bisa kembali ke bank indonesia

Koruptor yang punya banyak uang cash akan segera mengalir ke masyarakat NKRI

Setelah mengalir karna katakutan nantinya tidak berlaku

Bisa dilacak jika terlalu banyak uang yang dikeluarkan orang tersebut agar bisa segera ditangkap dan diadili","6358","https://youtu.be/GRA-0D9PojY?si=RNrPNibbLbVH9BRT","0","REDENOMINASI PURBAYA! Uang Rp1000 Jadi Rp1, Ribuan Triliun Akan Kembali ke Negara!","reply",,"0"
"@heritakkkirosopo","Semangat pak purbaya🎉🎉❤❤❤","6358","https://youtu.be/GRA-0D9PojY?si=RNrPNibbLbVH9BRT","0","REDENOMINASI PURBAYA! Uang Rp1000 Jadi Rp1, Ribuan Triliun Akan Kembali ke Negara!","reply",,"0"
"@JurAdiomura","Dukung, waktunya uang kejahatan keluar di belanjakan , bayar pajak pendapatan negara naik","6358","https://youtu.be/GRA-0D9PojY?si=RNrPNibbLbVH9BRT","0","REDENOMINASI PURBAYA! Uang Rp1000 Jadi Rp1, Ribuan Triliun Akan Kembali ke Negara!","reply",,"0"
"@MasDuki-z7u","Info perhari ini ringgit Malaysia menguat di 4000 rupiah","6358","https://youtu.be/GRA-0D9PojY?si=RNrPNibbLbVH9BRT","0","REDENOMINASI PURBAYA! Uang Rp1000 Jadi Rp1, Ribuan Triliun Akan Kembali ke Negara!","reply",,"0"
"@vickyyamido","Setuju","6358","https://youtu.be/GRA-0D9PojY?si=RNrPNibbLbVH9BRT","0","REDENOMINASI PURBAYA! Uang Rp1000 Jadi Rp1, Ribuan Triliun Akan Kembali ke Negara!","reply",,"0"
"@michel2keyindonesia803","Ready $100B for financing from indonesia come to me @michellgunadharma #nusantarakingdom kami terima idr 1:5 out 1 min 1Milyar idr","6358","https://youtu.be/GRA-0D9PojY?si=RNrPNibbLbVH9BRT","0","REDENOMINASI PURBAYA! Uang Rp1000 Jadi Rp1, Ribuan Triliun Akan Kembali ke Negara!","reply",,"0"
"@ab-gofar","Setuju,","6358","https://youtu.be/GRA-0D9PojY?si=RNrPNibbLbVH9BRT","0","REDENOMINASI PURBAYA! Uang Rp1000 Jadi Rp1, Ribuan Triliun Akan Kembali ke Negara!","reply",,"0"
"@Mahlintv","Saya aja orang biasa sepakat juga 😊","6358","https://youtu.be/GRA-0D9PojY?si=RNrPNibbLbVH9BRT","0","REDENOMINASI PURBAYA! Uang Rp1000 Jadi Rp1, Ribuan Triliun Akan Kembali ke Negara!","comment",,"0"
"@cristoperaritonang","Mudah-mudahan sesuai sama perkataan pak benix","6358","https://youtu.be/GRA-0D9PojY?si=RNrPNibbLbVH9BRT","0","REDENOMINASI PURBAYA! Uang Rp1000 Jadi Rp1, Ribuan Triliun Akan Kembali ke Negara!","comment",,"0"
"@jmfajarisnaini6305","Pake dua mata uang aja di Indonesia..$ dan Rp buar ada yg ngontrol dari luar.😊","6358","https://youtu.be/GRA-0D9PojY?si=RNrPNibbLbVH9BRT","0","REDENOMINASI PURBAYA! Uang Rp1000 Jadi Rp1, Ribuan Triliun Akan Kembali ke Negara!","comment",,"0"
"@rizalsmartmaster6062","500perak jadi apa ya","6358","https://youtu.be/GRA-0D9PojY?si=RNrPNibbLbVH9BRT","0","REDENOMINASI PURBAYA! Uang Rp1000 Jadi Rp1, Ribuan Triliun Akan Kembali ke Negara!","comment",,"0"
"@waswus9049","korea nolnya lebih nanyak dari Malaysia, apakah Malaysia lebih hebat dari Korea??😂😂 awalnya aku anggap anda lurus, tp ternyata belok juga.","6358","https://youtu.be/GRA-0D9PojY?si=RNrPNibbLbVH9BRT","0","REDENOMINASI PURBAYA! Uang Rp1000 Jadi Rp1, Ribuan Triliun Akan Kembali ke Negara!","comment",,"0"
"@Mahdi-t5w1o","Saya sangat setuju redenominasi ini, kalau betul di sah kan redenominasi jadi kita kaya bersama..., karnna lambat laun money illusion akan masuk secara langsung ke masyarakat,, dengan itu putaran ekonomi kita pun akan bertumbuh cepat.. 
Saya sangat setuju redominasi ini di lakukan...","6358","https://youtu.be/GRA-0D9PojY?si=RNrPNibbLbVH9BRT","0","REDENOMINASI PURBAYA! Uang Rp1000 Jadi Rp1, Ribuan Triliun Akan Kembali ke Negara!","comment",,"0"
"@syafiisyafii-ep5vw","Setuju redenominasi❤ Purbaya","6358","https://youtu.be/GRA-0D9PojY?si=RNrPNibbLbVH9BRT","0","REDENOMINASI PURBAYA! Uang Rp1000 Jadi Rp1, Ribuan Triliun Akan Kembali ke Negara!","comment",,"0"
"@suprianto-p9f","Indonesia siap redominasi","6358","https://youtu.be/GRA-0D9PojY?si=RNrPNibbLbVH9BRT","0","REDENOMINASI PURBAYA! Uang Rp1000 Jadi Rp1, Ribuan Triliun Akan Kembali ke Negara!","comment",,"0"
"@Asliyah-z3k","REDENOMINASI JEBAKAN BAGI KORUPTOR.. JIKA PEMERINTAH CERDAS DAN BIJAK SEGERA TERAPKAN REDENOMINASI.","6358","https://youtu.be/GRA-0D9PojY?si=RNrPNibbLbVH9BRT","0","REDENOMINASI PURBAYA! Uang Rp1000 Jadi Rp1, Ribuan Triliun Akan Kembali ke Negara!","comment",,"0"
"@arumatherapy1592","Jadi uang lama diganti baru❤","6358","https://youtu.be/GRA-0D9PojY?si=RNrPNibbLbVH9BRT","0","REDENOMINASI PURBAYA! Uang Rp1000 Jadi Rp1, Ribuan Triliun Akan Kembali ke Negara!","comment",,"0"
"@dailyquran1059","Saya dukung penuh dan bersemangat menantikan redenominasinya.Saran saya sih untuk pencetakan uangnya dari visual uang kertasnya jangan diganti dulu tetap seperti biasa cuman 3 angka nolnya aja yang dihapus dulu, buat masa transisi supaya rakyat terbiasa. Sebagaimana di harga harga produk ada 2 model harga untuk pembiasaan selama 2 tahun.","6358","https://youtu.be/GRA-0D9PojY?si=RNrPNibbLbVH9BRT","0","REDENOMINASI PURBAYA! Uang Rp1000 Jadi Rp1, Ribuan Triliun Akan Kembali ke Negara!","comment",,"0"
"@Asliyah-z3k","JIKA KORUPTOR INGIN SELAMAT HAPUS PROGRAM REDENOMINASI.","6358","https://youtu.be/GRA-0D9PojY?si=RNrPNibbLbVH9BRT","0","REDENOMINASI PURBAYA! Uang Rp1000 Jadi Rp1, Ribuan Triliun Akan Kembali ke Negara!","comment",,"0"
"@Lanangejagath","Apakah ada ternak ternak hinanya Jokowi dimari ? ? ? 🤣🤦","6358","https://youtu.be/GRA-0D9PojY?si=RNrPNibbLbVH9BRT","0","REDENOMINASI PURBAYA! Uang Rp1000 Jadi Rp1, Ribuan Triliun Akan Kembali ke Negara!","comment",,"0"
"@hantulaut4668","Maju bersama Purbaya. Dapat dipastikan Redenominasi membuat koruptor kalang kabut. Uang hasil curian yg selama ini tersembunyi mau tdk mau akan dibelanjakan bs berupa bidang tanah, rumah, mobil dsb, dengan demikian akan memudahkan KPK atau Kejaksaan untuk merampas aset"" koruptor.","6358","https://youtu.be/GRA-0D9PojY?si=RNrPNibbLbVH9BRT","0","REDENOMINASI PURBAYA! Uang Rp1000 Jadi Rp1, Ribuan Triliun Akan Kembali ke Negara!","comment",,"0"
"@ariefrahman8471","Indonesia setuju, saya yakin Indonesia sukses, sukses purbaya maju terus utk dilakukan secepatnya.","6358","https://youtu.be/GRA-0D9PojY?si=RNrPNibbLbVH9BRT","0","REDENOMINASI PURBAYA! Uang Rp1000 Jadi Rp1, Ribuan Triliun Akan Kembali ke Negara!","comment",,"0"
"@purwanto8674","Keinginan Rakyat yang mana... 
Dari 1.000 mau ke 1 atau ke 0.001 atau 1.000.000 itu tidak berpengaruh kalau masih kertas. 
Kalau mau merubah yaitu berbentuk emas. Misalnya Rp. 1,- = 1 gram emas. Baru Bagus.. kalau masih kertas kita tetap dimainkan sama orang atas atau geng nya asing salah satunya Malaydesh.","6358","https://youtu.be/GRA-0D9PojY?si=RNrPNibbLbVH9BRT","0","REDENOMINASI PURBAYA! Uang Rp1000 Jadi Rp1, Ribuan Triliun Akan Kembali ke Negara!","comment",,"0"
"@AzanZahazanulhaq","Segera laksanakan pakRedomisasi pk","6358","https://youtu.be/GRA-0D9PojY?si=RNrPNibbLbVH9BRT","0","REDENOMINASI PURBAYA! Uang Rp1000 Jadi Rp1, Ribuan Triliun Akan Kembali ke Negara!","comment",,"0"
"@NabilMaulana-vb5nc","Redominasi sangat setuju...dan setuju bangett....harap secepatnya ....terlaksana....nuwunn","6358","https://youtu.be/GRA-0D9PojY?si=RNrPNibbLbVH9BRT","0","REDENOMINASI PURBAYA! Uang Rp1000 Jadi Rp1, Ribuan Triliun Akan Kembali ke Negara!","comment",,"0"
"@NabilMaulana-vb5nc","Alasan redenominasi ...yg pertama rupiah menjadi berharga dan di hargai oleh negara luar...yg terutama biar bikin para koruptor kelabakan ...para judi onlen bandar narkoba...cuman disisi lain harga tanah akan semakin melonjak dratis terutama harga emas ....itu untung ruginya....simpel ajah deh....koreksi kalo saya salah...okee","6358","https://youtu.be/GRA-0D9PojY?si=RNrPNibbLbVH9BRT","0","REDENOMINASI PURBAYA! Uang Rp1000 Jadi Rp1, Ribuan Triliun Akan Kembali ke Negara!","comment",,"0"
"@kingjambrur","gua sebagai newbie accountant, sangat terbantu karena sering pusing nyari selisih gara2 salah input nol 🤣","6358","https://youtu.be/GRA-0D9PojY?si=RNrPNibbLbVH9BRT","0","REDENOMINASI PURBAYA! Uang Rp1000 Jadi Rp1, Ribuan Triliun Akan Kembali ke Negara!","comment",,"0"
"@Meisya_Days","Sy dukung trus gebrakan pak purbaya,spy cukong,sultan2 gk jelas,dan bos2 siluman bingung mw buang kmn uang hasil koruptor dan nepotisme...Bang BENNIX mintol kasih cepat redenominasi,kl bisa awal thun 2026 bisa terlaksna diseluruh indonesia..spy pdagang kecil,kki5 dan buruh bisa merasakan pertumbuhan ekonomi..semangat pak purbaya,dan trimakasih bnyak2 Bang Bennix dah dikasih pengetahuan tentang dunia politik dan ivestasi..mg2 kl sy dh ckup  dana..sy pengen ikut diclass investasi Bang Bennix🤲🤲🤲🤲...indonesia jaya💪💪💪","6358","https://youtu.be/GRA-0D9PojY?si=RNrPNibbLbVH9BRT","0","REDENOMINASI PURBAYA! Uang Rp1000 Jadi Rp1, Ribuan Triliun Akan Kembali ke Negara!","reply",,"0"
"@br2u","siapppp.....!!! anjing2 Purboyo siap beraksi.... 😂","6358","https://youtu.be/GRA-0D9PojY?si=RNrPNibbLbVH9BRT","0","REDENOMINASI PURBAYA! Uang Rp1000 Jadi Rp1, Ribuan Triliun Akan Kembali ke Negara!","reply",,"0"
"@sarsyed4531","Memanglah Vietnam yg No1 terendah nilai mata wangnya di Asia Tenggara, No2 terendah adalah mata wang Indon.. Tp Vietnam terkini investor makin masuk berinvestasi dinegaranya..dan semakin membangun ekonominya.. kmgkinan akn dtg Indon akn amb alih tmpt Vietnam utk nilai mata wang No1 terendah di Asia.. Tenggara..","6358","https://youtu.be/GRA-0D9PojY?si=RNrPNibbLbVH9BRT","0","REDENOMINASI PURBAYA! Uang Rp1000 Jadi Rp1, Ribuan Triliun Akan Kembali ke Negara!","reply",,"1"
"@fruitsbotanical4205","saya mendukung 👍👍👍","6358","https://youtu.be/GRA-0D9PojY?si=RNrPNibbLbVH9BRT","0","REDENOMINASI PURBAYA! Uang Rp1000 Jadi Rp1, Ribuan Triliun Akan Kembali ke Negara!","reply",,"0"
"@LinaMarlima-f1h","bagus benar bakal pada keluar dari bawah kasus dari bangker itu ular merah .hijou pada pergi belanja ekonami akan meningkat 👍👍👍👌👌","6358","https://youtu.be/GRA-0D9PojY?si=RNrPNibbLbVH9BRT","0","REDENOMINASI PURBAYA! Uang Rp1000 Jadi Rp1, Ribuan Triliun Akan Kembali ke Negara!","reply",,"0"
"@uhensuwarsa6787","Seruju","6358","https://youtu.be/GRA-0D9PojY?si=RNrPNibbLbVH9BRT","0","REDENOMINASI PURBAYA! Uang Rp1000 Jadi Rp1, Ribuan Triliun Akan Kembali ke Negara!","reply",,"0"
"@felisibnhuraira5396","Saya pernah ngawal atasan nukar rupiah ke US dollar....
Bagi yang masih punya martabat dan cinta Indonesia, pengalaman itu sangat memalukan dan memilukan...
Satu dus uang rupiah hanya senilai beberapa lembar uang dollar...
Saat itu saya mikir....
Serendah ini rupanya nilai mata uang kita....","6358","https://youtu.be/GRA-0D9PojY?si=RNrPNibbLbVH9BRT","0","REDENOMINASI PURBAYA! Uang Rp1000 Jadi Rp1, Ribuan Triliun Akan Kembali ke Negara!","reply",,"0"
"@Imanuelfollowingthepath","​ @juangiskandar4390  oon bgt lu. 100.000 jadi 10.000 cuma penyederhanaan penulisan nominalnya ajah nyet. Nilainya ttp sama. Bedanya para koruptor yg selama ini simpen duit cash nya di rumah bakalan pd kelabakan krn mata uang jenis baru yg tadinya mata uang yg merah itu yg tulisannya 100rb jadi 10rb. Otomatis duit2 100rb versi lama jadi gak berlaku. Klo ada yg belanja pake duit versi lama dlm jumlah yg gede pasti jadi menimbulken kecurigaan. Para koruptor itu pun akan kesulitan nuker di bank. Mngkn klo cuma puluhan juta nuker di bank msh bs di layani. Tp klo smpe ratusan juta bahkan smpe milyaran maka akan di pertanyakan asal usul dr uang2 versi lama itu","6358","https://youtu.be/GRA-0D9PojY?si=RNrPNibbLbVH9BRT","0","REDENOMINASI PURBAYA! Uang Rp1000 Jadi Rp1, Ribuan Triliun Akan Kembali ke Negara!","reply",,"0"
"@permadiiz3349","Oke 100.000 = jadi pecahan tertinggi 100.. Jangan sampai di tahun-tahun mendatang ada cetakan uang baru lembar pecahan 200-500 nih. Saya menolak keras akan hal itu.. Buat Bennix tolong nih","6358","https://youtu.be/GRA-0D9PojY?si=RNrPNibbLbVH9BRT","0","REDENOMINASI PURBAYA! Uang Rp1000 Jadi Rp1, Ribuan Triliun Akan Kembali ke Negara!","reply",,"0"
"@BelaianKasih","@bennix
@belaiankasih
dukung program pemerintah untuk kemajuan ekonomi indonesia demi kesejahteraan seluruh masyarakat indonesia.","6358","https://youtu.be/GRA-0D9PojY?si=RNrPNibbLbVH9BRT","0","REDENOMINASI PURBAYA! Uang Rp1000 Jadi Rp1, Ribuan Triliun Akan Kembali ke Negara!","reply",,"0"
"@Hermawan-x3x8j","Satuju","6358","https://youtu.be/GRA-0D9PojY?si=RNrPNibbLbVH9BRT","0","REDENOMINASI PURBAYA! Uang Rp1000 Jadi Rp1, Ribuan Triliun Akan Kembali ke Negara!","reply",,"0"
"@Imanuelfollowingthepath","​ @braderjunot  klo orang yg otaknya gak goblok pasti mendukung sejuta persen rencana realisasi redenominasi ini. Krn efek positifnya sgt banyak. Dan yg terpenting adl para koruptor yg duit hasil korupsinya tdk mngkn di taroh di bank tp di taroh dibrankas di rumah masing2 duit hasil korupsi mrk tdk lagi berlaku. Pasti mrk akan sgt pusing dan merasa terancam duit hasil korupsinya itu cuma jadi sampah krn gak bs buat beli apa2.. 

Klo mrk menukar duit2 tsb ke mata uang hasil redenominasi ini pastinya akan mrk tukar dlm jumlah besar. Hal ini tdk memungkinkan. Krn itu sama saja membongkar korupsi nya... 

Cara satu2nya biar redenominasi gak smpe terwujud ya bayarin anjng2 ky channel investasi ky yg loe sebutin itu...","6358","https://youtu.be/GRA-0D9PojY?si=RNrPNibbLbVH9BRT","0","REDENOMINASI PURBAYA! Uang Rp1000 Jadi Rp1, Ribuan Triliun Akan Kembali ke Negara!","reply",,"0"
"@artdietaka8315","14:10 salah satu alasan gua setuju 😁👍","6358","https://youtu.be/GRA-0D9PojY?si=RNrPNibbLbVH9BRT","0","REDENOMINASI PURBAYA! Uang Rp1000 Jadi Rp1, Ribuan Triliun Akan Kembali ke Negara!","reply",,"0"
"@Imanuelfollowingthepath","​ @Kia_Junior  iya biar duit hasil korupsi bokap lu bs di tuker bertahap di bank ke duit versi baru yg udah di redenominasi ya. Pemikiran monyet piaraan anjng2 koruptor klo mnrt gw mah pemikiran loe ini","6358","https://youtu.be/GRA-0D9PojY?si=RNrPNibbLbVH9BRT","0","REDENOMINASI PURBAYA! Uang Rp1000 Jadi Rp1, Ribuan Triliun Akan Kembali ke Negara!","reply",,"0"
"@Bangototpoli","Setuju, mata uang tetap menggunakan 2 digit di belakang koma.","6358","https://youtu.be/GRA-0D9PojY?si=RNrPNibbLbVH9BRT","0","REDENOMINASI PURBAYA! Uang Rp1000 Jadi Rp1, Ribuan Triliun Akan Kembali ke Negara!","reply",,"0"
"@Imanuelfollowingthepath","​ @KenziArka-z5r 100 perak buat loe beli beras ajah.. Mikir nyuk. Emang 100 perak msh di cetak dan beredar di masyarakat.??? 500 perak pun sptnya 10-20 thn kedepan udah gak berlaku lagi. Nilai mata uang terkecil 1000 rupiah di sederhana kan jadi 1 rupiah","6358","https://youtu.be/GRA-0D9PojY?si=RNrPNibbLbVH9BRT","0","REDENOMINASI PURBAYA! Uang Rp1000 Jadi Rp1, Ribuan Triliun Akan Kembali ke Negara!","reply",,"1"
"@Imanuelfollowingthepath","​ @creakidspakuan9637  nyet ini lg bahas redenominasi knp loe bawa2 urusan lain yg gak ada sangkut pautnya. Klo lu mau ngurusin negara knp lu gak daptar ajah jadi menteri atau minimal jadi ky monyet eko dan sakrongi di Dewan terhormat kita ituh","6358","https://youtu.be/GRA-0D9PojY?si=RNrPNibbLbVH9BRT","0","REDENOMINASI PURBAYA! Uang Rp1000 Jadi Rp1, Ribuan Triliun Akan Kembali ke Negara!","reply",,"0"
"@Imanuelfollowingthepath","​ @nobodycares-e3g  lu wkt sekolah SD berapa thn nyuk. Klo baca komen lu ini tebakan gw lu butuh 10thn buat bs lulus dr SD. Klo krn faktor kenakalan bocil2 smpe lu nelor di satu kelas smpe berulang ulang mah mngkn msh bs di maklumin. Tp kyknya faktor lu butuh 10thn buat lulus dr SD krn faktor kapasitas otak lu yg beda sama manusia pd umumnya deh. Mngkn otak lu cuma setara sama ayam atau kambing jadinya oon","6358","https://youtu.be/GRA-0D9PojY?si=RNrPNibbLbVH9BRT","0","REDENOMINASI PURBAYA! Uang Rp1000 Jadi Rp1, Ribuan Triliun Akan Kembali ke Negara!","reply",,"0"
"@AiDa-ur7te","👍🏻👍🏻👍🏻👍🏻👍🏻👍🏻👍🏻👍🏻👍🏻👍🏻","6358","https://youtu.be/GRA-0D9PojY?si=RNrPNibbLbVH9BRT","0","REDENOMINASI PURBAYA! Uang Rp1000 Jadi Rp1, Ribuan Triliun Akan Kembali ke Negara!","reply",,"0"
"@ivanahmad1312","nyawa pak purbaya bisa ter ancam pak , banyak mafia yg bisa jadi bangkruk","6358","https://youtu.be/GRA-0D9PojY?si=RNrPNibbLbVH9BRT","0","REDENOMINASI PURBAYA! Uang Rp1000 Jadi Rp1, Ribuan Triliun Akan Kembali ke Negara!","reply",,"0"
"@sriepainting7442","Sy dukung pak Purbaya, semangat pak","6358","https://youtu.be/GRA-0D9PojY?si=RNrPNibbLbVH9BRT","0","REDENOMINASI PURBAYA! Uang Rp1000 Jadi Rp1, Ribuan Triliun Akan Kembali ke Negara!","reply",,"0"
"@niko7722-n1i","Maunya berantas judol, kalo udah gak percaya parcok ya redenominasi jalan terbaik.","6358","https://youtu.be/GRA-0D9PojY?si=RNrPNibbLbVH9BRT","0","REDENOMINASI PURBAYA! Uang Rp1000 Jadi Rp1, Ribuan Triliun Akan Kembali ke Negara!","reply",,"0"
"@niko7722-n1i","​ @braderjunot coba masukin parameter judol dan parcok yg malas berantas, pasti jawabannya beda 😂😂😂","6358","https://youtu.be/GRA-0D9PojY?si=RNrPNibbLbVH9BRT","0","REDENOMINASI PURBAYA! Uang Rp1000 Jadi Rp1, Ribuan Triliun Akan Kembali ke Negara!","reply",,"0"
"@niko7722-n1i","​ @satrianingrat9946 berantas judol dipercepat","6358","https://youtu.be/GRA-0D9PojY?si=RNrPNibbLbVH9BRT","0","REDENOMINASI PURBAYA! Uang Rp1000 Jadi Rp1, Ribuan Triliun Akan Kembali ke Negara!","reply",,"0"
"@niko7722-n1i","​ @sarsyed4531 kebijakan pemerintah dan ormas pemalak mempengaruhi investor asing masuk.","6358","https://youtu.be/GRA-0D9PojY?si=RNrPNibbLbVH9BRT","0","REDENOMINASI PURBAYA! Uang Rp1000 Jadi Rp1, Ribuan Triliun Akan Kembali ke Negara!","reply",,"0"
"@niko7722-n1i","​ @nobodycares-e3g jaman Darmin Nasution judol blm merebak kayak gini. Masih percaya parcok berantas judol?","6358","https://youtu.be/GRA-0D9PojY?si=RNrPNibbLbVH9BRT","0","REDENOMINASI PURBAYA! Uang Rp1000 Jadi Rp1, Ribuan Triliun Akan Kembali ke Negara!","reply",,"0"
"@niko7722-n1i","​ @PREDATOR91 kita nepalkan....","6358","https://youtu.be/GRA-0D9PojY?si=RNrPNibbLbVH9BRT","0","REDENOMINASI PURBAYA! Uang Rp1000 Jadi Rp1, Ribuan Triliun Akan Kembali ke Negara!","reply",,"0"
"@sharkbite6083","Giman?? 8 tuntutan beinix akhirnya apa??, tuntutan pertama hukuman mati aj bowo g setujuh 😂 clickbaitnya keterlaluan","6358","https://youtu.be/GRA-0D9PojY?si=RNrPNibbLbVH9BRT","0","REDENOMINASI PURBAYA! Uang Rp1000 Jadi Rp1, Ribuan Triliun Akan Kembali ke Negara!","reply",,"0"
"@niko7722-n1i","​@user-kqfsjhuHalah.... Selama ini Lo beli barang di betamart dan julimart kembalian 200 perak gak mau diambil 😂😂😂","6358","https://youtu.be/GRA-0D9PojY?si=RNrPNibbLbVH9BRT","0","REDENOMINASI PURBAYA! Uang Rp1000 Jadi Rp1, Ribuan Triliun Akan Kembali ke Negara!","reply",,"0"
"@asepabdullatif2735","Kawal terus pak purabaya demi perbaikan ekonomi indonesia majuu","6358","https://youtu.be/GRA-0D9PojY?si=RNrPNibbLbVH9BRT","0","REDENOMINASI PURBAYA! Uang Rp1000 Jadi Rp1, Ribuan Triliun Akan Kembali ke Negara!","reply",,"0"
"@niko7722-n1i","​ @msledge9309 otak lo dipake dong.... Jgn asal komen","6358","https://youtu.be/GRA-0D9PojY?si=RNrPNibbLbVH9BRT","0","REDENOMINASI PURBAYA! Uang Rp1000 Jadi Rp1, Ribuan Triliun Akan Kembali ke Negara!","reply",,"0"
"@niko7722-n1i","​ @Bob_Pre gak masalah, toh harga kripto ada yg $0,000005","6358","https://youtu.be/GRA-0D9PojY?si=RNrPNibbLbVH9BRT","0","REDENOMINASI PURBAYA! Uang Rp1000 Jadi Rp1, Ribuan Triliun Akan Kembali ke Negara!","reply",,"1"
"@niko7722-n1i","​ @PREDATOR91 betul... Sertakan NPWP","6358","https://youtu.be/GRA-0D9PojY?si=RNrPNibbLbVH9BRT","0","REDENOMINASI PURBAYA! Uang Rp1000 Jadi Rp1, Ribuan Triliun Akan Kembali ke Negara!","reply",,"0"
"@niko7722-n1i","​ @andy_138firdaus5 Lo kira bisa gampang masuk ke negara lain tanpa ijin pengawas angkasa, itu penyelundupan namanya. Bisa² diroket dari jauh sblm masuk negara lain.
Kayak Bu Susi bom nelayan asing","6358","https://youtu.be/GRA-0D9PojY?si=RNrPNibbLbVH9BRT","0","REDENOMINASI PURBAYA! Uang Rp1000 Jadi Rp1, Ribuan Triliun Akan Kembali ke Negara!","reply",,"0"
"@niko7722-n1i","​ @mochammadirchamniiqbal3735 utamanya buat berantas judol, uang kartel narkoba dan tangkap koruptor....","6358","https://youtu.be/GRA-0D9PojY?si=RNrPNibbLbVH9BRT","0","REDENOMINASI PURBAYA! Uang Rp1000 Jadi Rp1, Ribuan Triliun Akan Kembali ke Negara!","reply",,"0"
"@niko7722-n1i","​ @shasamunib68 lihat kmrn para koruptor yg ditangkap dgn duit berkoper koper. Setelah redenominasi makin banyak terlihat koruptor nongol","6358","https://youtu.be/GRA-0D9PojY?si=RNrPNibbLbVH9BRT","0","REDENOMINASI PURBAYA! Uang Rp1000 Jadi Rp1, Ribuan Triliun Akan Kembali ke Negara!","reply",,"0"
"@niko7722-n1i","​ @suprasupra-kk5pi emang yg selama ini nyimpen duit cash yg jumlahnya milyaran gak ditanya dulu asal uangnya saat penukaran uang baru?
Kalo uang di rekening bank mah gampang tinggal hapus 3 nol di rekening 😂😂😂","6358","https://youtu.be/GRA-0D9PojY?si=RNrPNibbLbVH9BRT","0","REDENOMINASI PURBAYA! Uang Rp1000 Jadi Rp1, Ribuan Triliun Akan Kembali ke Negara!","reply",,"0"
"@anikdwi337","​ @sarsyed4531 : Kamu Malaydesh IQ 15 pengidap NPD & denial syndrom akut, jelas² gak paham isi konten Bennix dan beri komentar asal mangap hanya karena Bennix pernah ulas ketergadaian negaramu.

Minggir sajalah kau makhluk dinosaurus.","6358","https://youtu.be/GRA-0D9PojY?si=RNrPNibbLbVH9BRT","0","REDENOMINASI PURBAYA! Uang Rp1000 Jadi Rp1, Ribuan Triliun Akan Kembali ke Negara!","reply",,"0"
"@anikdwi337","​ @sharpen_key_tone  : emang ada urusan apa sama negara Lo?","6358","https://youtu.be/GRA-0D9PojY?si=RNrPNibbLbVH9BRT","0","REDENOMINASI PURBAYA! Uang Rp1000 Jadi Rp1, Ribuan Triliun Akan Kembali ke Negara!","reply",,"0"
"@VALZAZ22","​ @sarsyed4531 
Omong kosong","6358","https://youtu.be/GRA-0D9PojY?si=RNrPNibbLbVH9BRT","0","REDENOMINASI PURBAYA! Uang Rp1000 Jadi Rp1, Ribuan Triliun Akan Kembali ke Negara!","reply",,"0"
"@doskibeasudara","​ @twinflowers9977 ya ga bisa,,itu yg di ubah mulai dari 1000-100.000 ,,kalo koin ga berlaku","6358","https://youtu.be/GRA-0D9PojY?si=RNrPNibbLbVH9BRT","0","REDENOMINASI PURBAYA! Uang Rp1000 Jadi Rp1, Ribuan Triliun Akan Kembali ke Negara!","reply",,"0"
"@anikdwi337","​ @OplosNesia_You-sv9qo : kenapa juga harus nyebut Malaydesh, negara yang sudah digadaikan sama PM Anoa? Gak ada urusan.

Kamu cuma bisa melihat duit dari sisi kurs, RM lebih tinggi daripada Rp tapi tanpa memahami apa arti ""daya beli"".
Tiket laga sepakbola di Malaydesh RM 40 gak habis terjual karena dibilang kemahalan dan minta diturunkan.

Beda cerita di Senayan; untuk event yang sama, tiket masuk senilai RM 500 habis terjual dalam hitungan jam.

Apa yang laik ditiru dari negara semacam Malaydesh? Rasisnya?
Suka menghina, merendahkan, menyiksa, membunuh atau budaya nyolong, klaim, tukang tuduh, pemalsu dokumen?

Atau dongengan gak masuk akal kompresor semacam Abdul Mu'ati, Reevany Bustami, Awang Sariyan dan Solehah Yaacob itu?

Kalian memang serba gak masuk akal, penderita delusional, pengidap NPD dan denial syndrom yang tingkat keparahannya sudah akut.","6358","https://youtu.be/GRA-0D9PojY?si=RNrPNibbLbVH9BRT","0","REDENOMINASI PURBAYA! Uang Rp1000 Jadi Rp1, Ribuan Triliun Akan Kembali ke Negara!","reply",,"0"
"@Imanuelfollowingthepath","​ @permadiiz3349  klo dongo tlg jgn kelewat ngotot klo komen. Bikin malu diri lu sendiri ngok","6358","https://youtu.be/GRA-0D9PojY?si=RNrPNibbLbVH9BRT","0","REDENOMINASI PURBAYA! Uang Rp1000 Jadi Rp1, Ribuan Triliun Akan Kembali ke Negara!","reply",,"0"
"@YayaMulyana-c7e","Satuju pisan lur","6358","https://youtu.be/GRA-0D9PojY?si=RNrPNibbLbVH9BRT","0","REDENOMINASI PURBAYA! Uang Rp1000 Jadi Rp1, Ribuan Triliun Akan Kembali ke Negara!","reply",,"0"
"@Suharditohadi13485","Redenominasi akan membuat para koruptor berusaha untuk mencegah,sebab uang mrk yg disembunyikan scr cash akan terusik! Bayangin uang milyaran bhkn hingga triliunan akan kluar dari persembunyian untuk ditukar dg uang baru hasil redenominasi! Saat ini mrk akan menggunakan uang tersebut untuk dicuci dg berbagai cara investasi, dititipkan kpd orang lain, ditukarkan dg valas dll. Redenominasi secepatnya itu bagus...bkn ditunda tunda bro!","6358","https://youtu.be/GRA-0D9PojY?si=RNrPNibbLbVH9BRT","0","REDENOMINASI PURBAYA! Uang Rp1000 Jadi Rp1, Ribuan Triliun Akan Kembali ke Negara!","reply",,"1"
"@sribudipurwanto4671","HARGA DIRI BANGSA om Ben...
Supaya tidak disepelekan orang luar / asing.
Banyak turis yg nge tawain rupiah , nilai rendah banyakan nol","6358","https://youtu.be/GRA-0D9PojY?si=RNrPNibbLbVH9BRT","0","REDENOMINASI PURBAYA! Uang Rp1000 Jadi Rp1, Ribuan Triliun Akan Kembali ke Negara!","reply",,"0"
"@ParwantoPlolo","SIAP👍","6358","https://youtu.be/GRA-0D9PojY?si=RNrPNibbLbVH9BRT","0","REDENOMINASI PURBAYA! Uang Rp1000 Jadi Rp1, Ribuan Triliun Akan Kembali ke Negara!","reply",,"0"
"@Astri-ci1lb","Setuju sdh gak sabar nih","6358","https://youtu.be/GRA-0D9PojY?si=RNrPNibbLbVH9BRT","0","REDENOMINASI PURBAYA! Uang Rp1000 Jadi Rp1, Ribuan Triliun Akan Kembali ke Negara!","reply",,"0"
"@KetawaPedia2901","Sudah dong isi petisi ini mantap","6358","https://youtu.be/GRA-0D9PojY?si=RNrPNibbLbVH9BRT","0","REDENOMINASI PURBAYA! Uang Rp1000 Jadi Rp1, Ribuan Triliun Akan Kembali ke Negara!","reply",,"0"
"@yzdas912","Setujuu","6358","https://youtu.be/GRA-0D9PojY?si=RNrPNibbLbVH9BRT","0","REDENOMINASI PURBAYA! Uang Rp1000 Jadi Rp1, Ribuan Triliun Akan Kembali ke Negara!","reply",,"0"
"@BaronSudjarwo","Bajingan koruptor","6358","https://youtu.be/GRA-0D9PojY?si=RNrPNibbLbVH9BRT","0","REDENOMINASI PURBAYA! Uang Rp1000 Jadi Rp1, Ribuan Triliun Akan Kembali ke Negara!","comment",,"0"
"@Kusmaryanta63","Lha Purbaya bisa aja punya ide.
Bagaimana denga Prabowo ?","6358","https://youtu.be/GRA-0D9PojY?si=RNrPNibbLbVH9BRT","0","REDENOMINASI PURBAYA! Uang Rp1000 Jadi Rp1, Ribuan Triliun Akan Kembali ke Negara!","comment",,"0"
